{
  "event_id": "evt_01jg8w4m2c5tbfy1",
  "campaign_id": "camp_2026_04_tampa",
  "task_id": "task_underwriting_01",
  "parent_event_id": null,
  "t": "2026-04-18T11:05:44.902Z",
  "emitter": {
    "kind": "orchestrator",
    "id": "primary_orchestrator",
    "adapter": "claude_code"
  },
  "kind": "ticket_resolved",
  "payload": {
    "ticket_ref": "tkt_zoning_str",
    "gist": "STR permitted with county license; HOA silent",
    "resolution_ref": "evt_01jg8w4k7p9smdq3"
  },
  "refs": {
    "memory_refs": ["mem_20260401_rental_tampa_zoning"],
    "contract_ref": "agents/orchestrator/primary.json",
    "prior_packet_ref": "pkt_underwriting_01_r1"
  },
  "cost": { "tokens_in": 412, "tokens_out": 96, "wall_clock_ms": 730 },
  "flags": ["guardrail_pass"]
}
